{
  "$schema": "http://json-schema.org/draft-07/schema#",
  "$id": "https://github.com/Hen-Heang/ax-engineering-harness/schemas/run/v1",
  "title": "RunRecord",
  "description": "AX Harness v1 run record. Recorded runs require local-executor provenance and execution evidence; examples are illustrative and cannot claim that provenance.",
  "type": "object",
  "additionalProperties": false,
  "required": ["schemaVersion", "id", "kind", "task", "profile", "retries", "tools", "filesRead", "filesChanged", "gates", "notes"],
  "properties": {
    "schemaVersion": { "const": 1 },
    "id": { "$ref": "#/definitions/identifier" },
    "kind": {
      "enum": ["example", "recorded"],
      "description": "example is illustrative. recorded requires evidence produced by the controlled local executor."
    },
    "source": { "const": "local-executor" },
    "project": { "$ref": "#/definitions/identifier" },
    "startedAt": { "$ref": "#/definitions/timestamp" },
    "finishedAt": { "$ref": "#/definitions/timestamp" },
    "durationMs": { "type": "integer", "minimum": 0 },
    "finalStatus": { "enum": ["pass", "fail", "incomplete"] },
    "task": { "$ref": "#/definitions/text" },
    "agent": { "$ref": "#/definitions/identifier", "description": "Role that owned the task." },
    "profile": { "$ref": "#/definitions/identifier" },
    "status": { "enum": ["completed", "failed", "blocked", "abandoned"] },
    "durationSeconds": { "type": "integer", "minimum": 0, "description": "Omit when the duration was not measured." },
    "retries": { "type": "integer", "minimum": 0, "maximum": 5 },
    "tools": { "type": "array", "minItems": 0, "maxItems": 16, "items": { "enum": ["codebase", "docs", "github", "database"] } },
    "filesRead": { "$ref": "#/definitions/paths" },
    "filesChanged": { "$ref": "#/definitions/paths" },
    "gates": {
      "type": "array",
      "minItems": 0,
      "maxItems": 32,
      "items": {
        "type": "object",
        "additionalProperties": false,
        "required": ["stage", "outcome"],
        "properties": {
          "stage": { "$ref": "#/definitions/identifier" },
          "outcome": {
            "enum": ["passed", "failed", "timed-out", "execution-error", "unavailable", "unrun"],
            "description": "unavailable and unrun are distinct from passed and must never be reported as a pass."
          },
          "title": { "$ref": "#/definitions/line" },
          "command": { "type": ["string", "null"], "maxLength": 2048 },
          "reason": { "type": ["string", "null"], "maxLength": 64 },
          "execution": { "$ref": "#/definitions/execution" }
        }
      }
    },
    "eval": {
      "type": "object",
      "additionalProperties": false,
      "required": ["id", "percent", "passed"],
      "properties": {
        "id": { "$ref": "#/definitions/identifier" },
        "percent": { "type": "integer", "minimum": 0, "maximum": 100 },
        "passed": { "type": "boolean" }
      }
    },
    "measurements": {
      "type": "object",
      "additionalProperties": false,
      "description": "Omit any field that was not measured. An absent field means unmeasured, not zero.",
      "properties": {
        "inputTokens": { "type": "integer", "minimum": 0 },
        "outputTokens": { "type": "integer", "minimum": 0 },
        "costUsd": { "type": "number", "minimum": 0 }
      }
    },
    "notes": { "$ref": "#/definitions/notes" }
  },
  "allOf": [
    {
      "if": { "properties": { "kind": { "const": "recorded" } }, "required": ["kind"] },
      "then": {
        "properties": {
          "source": {}, "project": {}, "startedAt": {}, "finishedAt": {},
          "durationMs": {}, "finalStatus": {}
        },
        "required": ["source", "project", "startedAt", "finishedAt", "durationMs", "finalStatus"]
      },
      "else": {
        "properties": {
          "agent": {}, "status": {}, "source": false, "project": false,
          "startedAt": false, "finishedAt": false, "durationMs": false,
          "finalStatus": false
        },
        "required": ["agent", "status"]
      }
    }
  ],
  "definitions": {
    "identifier": { "type": "string", "pattern": "^[a-z][a-z0-9_-]{0,63}$" },
    "timestamp": { "type": "string", "pattern": "^\\d{4}-\\d{2}-\\d{2}T\\d{2}:\\d{2}:\\d{2}\\.\\d{3}Z$" },
    "line": { "type": "string", "minLength": 1, "maxLength": 96, "pattern": "^(?=.*\\S)[^\\u0000-\\u001f]+$" },
    "execution": {
      "type": "object",
      "additionalProperties": false,
      "required": ["program", "args", "startedAt", "finishedAt", "durationMs", "exitCode", "status", "timedOut", "outputTruncated"],
      "properties": {
        "program": { "type": ["string", "null"], "maxLength": 512 },
        "args": { "type": "array", "maxItems": 128, "items": { "type": "string", "maxLength": 2048 } },
        "startedAt": { "$ref": "#/definitions/timestamp" },
        "finishedAt": { "$ref": "#/definitions/timestamp" },
        "durationMs": { "type": "integer", "minimum": 0 },
        "exitCode": { "type": ["integer", "null"] },
        "status": { "enum": ["passed", "failed", "timed-out", "unsupported", "execution-error"] },
        "timedOut": { "type": "boolean" },
        "outputTruncated": { "type": "boolean" },
        "unsupportedReason": { "enum": ["empty", "shell-syntax"] },
        "errorCode": { "type": "string", "minLength": 1, "maxLength": 64 }
      }
    },
    "text": { "type": "string", "minLength": 1, "maxLength": 512, "pattern": "^(?=.*\\S)[^\\u0000-\\u001f]+$" },
    "path": {
      "type": "string",
      "minLength": 1,
      "maxLength": 512,
      "pattern": "^(?!/)(?!.*(?:^|/)\\.{1,2}(?:/|$))(?!.*[\\\\:\\u0000-\\u001f]).+$"
    },
    "paths": { "type": "array", "minItems": 0, "maxItems": 64, "items": { "$ref": "#/definitions/path" } },
    "note": { "type": "string", "minLength": 1, "maxLength": 320, "pattern": "^(?=.*\\S)[^\\u0000-\\u001f]+$" },
    "notes": { "type": "array", "minItems": 1, "maxItems": 32, "items": { "$ref": "#/definitions/note" } }
  }
}
